"user_id","question_id","idanswers","answer"
"48","1","237","I'm a person who is fascinated by the little things in life. I enjoy adventure and the adrenaline rush that comes with it. Apart from pursuing a degree in Computer Science, I am passionate about hiking and traveling. "
"48","6","246","My weakness is that I social interaction does not come naturally to me and I'm mostly an introvert. And probably another weakness is that I canot "
"48","34","249","Not really."
"48","39","252","Probably low confidence in myself."
"48","40","256","Respected"
"48","26","258","I should be hired for my skill in a field."
